,source_file,sentence,begin,end,annotator,_annotation,text,_sentence_text,annotation,sentiment_cat,aspect_cat
1538,BHL_1025_sample_French_20.0.txt,BHL_1025_sample_French_20.0.txt_7861-7936,7902,7911,Eltine_Janssens,"w.c.Link(Dependent=w.c.Emotions_Entities(ASP_SENT_NULL=NULL, begin=7902, end=7911, entitycategory=PERSON, sentimentcategory=3), Governor=w.c.Emotions_Entities(ASP_SENT_NULL=SENTIMENT, begin=7890, end=7901, sentimentcategory=4), begin=7902, end=7911, linktype=sentiment_of)",serviteur,"Sans plus je me répète votre affectionné serviteur et ami , Aimé Bonpland .",NULL,4,PERSON
1539,BHL_1025_sample_French_20.0.txt,BHL_1025_sample_French_20.0.txt_7861-7936,7915,7918,Eltine_Janssens,"w.c.Link(Dependent=w.c.Emotions_Entities(ASP_SENT_NULL=NULL, begin=7915, end=7918, entitycategory=PERSON, sentimentcategory=4), Governor=w.c.Emotions_Entities(ASP_SENT_NULL=SENTIMENT, begin=7890, end=7901, sentimentcategory=4), begin=7915, end=7918, linktype=sentiment_of)",ami,"Sans plus je me répète votre affectionné serviteur et ami , Aimé Bonpland .",NULL,4,PERSON
1540,BHL_1025_sample_French_20.0.txt,BHL_1025_sample_French_20.0.txt_8851-9101,8884,8892,Eltine_Janssens,"w.c.Link(Dependent=w.c.Emotions_Entities(ASP_SENT_NULL=ASPECT, begin=8884, end=8892, entitycategory=PERSON), Governor=w.c.Emotions_Entities(ASP_SENT_NULL=SENTIMENT, begin=8879, end=8883, sentimentcategory=4), begin=8884, end=8892, linktype=sentiment_of)",Humboldt,"Combien je serais heureux , cher Humboldt , si je parvenais à causer avec un individu qui t ' a vu tout récemment , combien de demandes ne lui ferais-je pas sur toi , sur ton existence , sur l'état de ta santé que je considère tou- jours être bonne !",ASPECT,4,PERSON
1541,BHL_1025_sample_French_20.0.txt,BHL_1025_sample_French_20.0.txt_8851-9101,8884,8892,Eltine_Janssens,"w.c.Link(Dependent=w.c.Emotions_Entities(ASP_SENT_NULL=ASPECT, begin=8884, end=8892, entitycategory=PERSON), Governor=w.c.Emotions_Entities(ASP_SENT_NULL=NULL, begin=9132, end=9135, entitycategory=PERSON, sentimentcategory=4), begin=8884, end=8892, linktype=refers_to)",Humboldt,"Combien je serais heureux , cher Humboldt , si je parvenais à causer avec un individu qui t ' a vu tout récemment , combien de demandes ne lui ferais-je pas sur toi , sur ton existence , sur l'état de ta santé que je considère tou- jours être bonne !",ASPECT,4,PERSON
1542,BHL_1025_sample_French_20.0.txt,BHL_1025_sample_French_20.0.txt_9102-9391,9132,9135,Eltine_Janssens,"w.c.Link(Dependent=w.c.Emotions_Entities(ASP_SENT_NULL=NULL, begin=9132, end=9135, entitycategory=PERSON, sentimentcategory=4), Governor=w.c.Emotions_Entities(ASP_SENT_NULL=SENTIMENT, begin=9123, end=9131, sentimentcategory=4), begin=9132, end=9135, linktype=sentiment_of)",ami,"Tout récemment , mon illustre ami , il vient de mourir dans cette province un homme âgé de cent un ans Quelle perspective pour nous qui avons passé notre quatre-vingtième Le mois d'août prochain , le 28 , je compléterai ma quatre- vingt-quatrième année et j'ai trois ans de moins que toi .",NULL,4,PERSON
1543,BHL_1025_sample_French_20.0.txt,BHL_1025_sample_French_20.0.txt_10301-10569,10422,10458,Eltine_Janssens,"w.c.Link(Dependent=w.c.Emotions_Entities(ASP_SENT_NULL=ASPECT, begin=10422, end=10458, entitycategory=ORGANISATION), Governor=w.c.Emotions_Entities(ASP_SENT_NULL=SENTIMENT, begin=10414, end=10421, sentimentcategory=4), begin=10422, end=10458, linktype=sentiment_of)",université prussienne de Greifswalde,Mais aujourd'hui je re- double de courage par l'espoir * que j'ai d'entrer en relation directe et suivie avec la célèbre université prussienne de Greifswalde et j'ai la douce espérance de pouvoir enrichir la Prusse des produits végétaux et minéraux de cette Amérique .,ASPECT,4,ORGANISATION
1544,BHL_1025_sample_French_20.0.txt,BHL_1025_sample_French_20.0.txt_12064-12231,12091,12094,Eltine_Janssens,"w.c.Link(Dependent=w.c.Emotions_Entities(ASP_SENT_NULL=NULL, begin=12091, end=12094, entitycategory=PERSON, sentimentcategory=4), Governor=w.c.Emotions_Entities(ASP_SENT_NULL=SENTIMENT, begin=12082, end=12090), begin=12091, end=12094, linktype=sentiment_of)",ami,"A Santa-Ana , mon illustre ami , je passe une vie tranquille et je vais mourir là et sépulter ( 1 ) mes tristes restes à l'ombre des arbres nombreux que j'ai plantés .",NULL,,PERSON
1545,BHL_1025_sample_French_20.0.txt,BHL_1025_sample_French_20.0.txt_12232-12421,12384,12391,Eltine_Janssens,"w.c.Link(Dependent=w.c.Emotions_Entities(ASP_SENT_NULL=ASPECT, begin=12384, end=12391, entitycategory=FLORA), Governor=w.c.Emotions_Entities(ASP_SENT_NULL=SENTIMENT, begin=12406, end=12419, sentimentcategory=2), begin=12384, end=12391, linktype=sentiment_of)",oranges,"Quant à ma propriété à San-Borja , personne n ' a voulu jusqu ' à présent me payer les nombreux arbres fruitiers que j'ai plantés et qui me donnent des oranges d'une douceur inappréciable .",ASPECT,2,FLORA
1546,BHL_1025_sample_French_20.0.txt,BHL_1025_sample_French_20.0.txt_12620-13040,12952,12962,Eltine_Janssens,"w.c.Link(Dependent=w.c.Emotions_Entities(ASP_SENT_NULL=ASPECT, begin=12952, end=12962, entitycategory=FLORA), Governor=w.c.Emotions_Entities(ASP_SENT_NULL=SENTIMENT, begin=12946, end=12951, sentimentcategory=4), begin=12952, end=12962, linktype=sentiment_of)",végétation,"Tout récemment j'ai eu le bonheur de visiter la capitale du Paraguay et j'ai ramassé dans peu de jours un assez bon nombre de plantes parmi lesquelles plusieurs sont rares et d'autres nou- Je ne crains pas de dire que pendant le cours de ton immortel voyage nous n'avons pas trouvé un seul point qui nous ait offert une aussi belle végétation , un site aussi varié et aussi enchan- teur que les environs de l'Assuncfon .",ASPECT,4,FLORA
1547,BHL_1025_sample_French_20.0.txt,BHL_1025_sample_French_20.0.txt_14314-14498,14325,14328,Eltine_Janssens,"w.c.Link(Dependent=w.c.Emotions_Entities(ASP_SENT_NULL=NULL, begin=14325, end=14328, entitycategory=PERSON, sentimentcategory=3), Governor=w.c.Emotions_Entities(ASP_SENT_NULL=SENTIMENT, begin=14318, end=14324), begin=14325, end=14328, linktype=sentiment_of)",ami,"Mon savant ami , en voyant des palmiers et des orangers , je me rappelle de la visite que nous avions faite à Hyèreset à la Cote de Cullera en Espagne qui toute est bordée d'orangers .",NULL,,PERSON
1548,BHL_1025_sample_French_20.0.txt,BHL_1025_sample_French_20.0.txt_14314-14498,14345,14353,Eltine_Janssens,"w.c.Link(Dependent=w.c.Emotions_Entities(ASP_SENT_NULL=ASPECT, begin=14345, end=14353, entitycategory=FLORA), Governor=w.c.Emotions_Entities(ASP_SENT_NULL=ASPECT, begin=14508, end=14529, entitycategory=FLORA), begin=14345, end=14353, linktype=refers_to)",palmiers,"Mon savant ami , en voyant des palmiers et des orangers , je me rappelle de la visite que nous avions faite à Hyèreset à la Cote de Cullera en Espagne qui toute est bordée d'orangers .",ASPECT,,FLORA
1549,BHL_1025_sample_French_20.0.txt,BHL_1025_sample_French_20.0.txt_14314-14498,14361,14369,Eltine_Janssens,"w.c.Link(Dependent=w.c.Emotions_Entities(ASP_SENT_NULL=ASPECT, begin=14361, end=14369, entitycategory=FLORA), Governor=w.c.Emotions_Entities(ASP_SENT_NULL=ASPECT, begin=14508, end=14529, entitycategory=FLORA), begin=14361, end=14369, linktype=refers_to)",orangers,"Mon savant ami , en voyant des palmiers et des orangers , je me rappelle de la visite que nous avions faite à Hyèreset à la Cote de Cullera en Espagne qui toute est bordée d'orangers .",ASPECT,,FLORA
1550,BHL_1025_sample_French_20.0.txt,BHL_1025_sample_French_20.0.txt_14499-14657,14508,14529,Eltine_Janssens,"w.c.Link(Dependent=w.c.Emotions_Entities(ASP_SENT_NULL=ASPECT, begin=14508, end=14529, entitycategory=FLORA), Governor=w.c.Emotions_Entities(ASP_SENT_NULL=SENTIMENT, begin=14547, end=14562, sentimentcategory=4), begin=14508, end=14529, linktype=sentiment_of)",es- pèces de végétaux,Ces deux es- pèces de végétaux te causèrent une rare admiration et tu répétais souvent que tu serais heureux de vivre au milieu des palmiers et des orangers .,ASPECT,4,FLORA
1551,BHL_1025_sample_French_20.0.txt,BHL_1025_sample_French_20.0.txt_14658-15108,14889,14908,Eltine_Janssens,"w.c.Link(Dependent=w.c.Emotions_Entities(ASP_SENT_NULL=ASPECT, begin=14889, end=14908, entitycategory=FLORA), Governor=w.c.Emotions_Entities(ASP_SENT_NULL=SENTIMENT, begin=14918, end=14924, sentimentcategory=5), begin=14889, end=14908, linktype=sentiment_of)",fruits de l'oranger,"Aujourd'hui dans ma ferme de Santa-Ana j'ai des bois de ces deux essences d'arbres et je préfère les orangers aux palmiers sousle rapport de la vue mais surtout pour le feuillage qui est permanent , d'un beau vert foncé , pour les fruits de l'oranger qui sont exquis , semblables aux oranges de la Havane , enfin pour 21 ( > CORRESPONDANCE D AIMÉ BONPLAND la beauté des fleurs qui embaument l'atmosphère et qui pro- duisent l'eau de fleur d'oranger .",ASPECT,5,FLORA
1552,BHL_1025_sample_French_20.0.txt,BHL_1025_sample_French_20.0.txt_15520-15614,15530,15538,Eltine_Janssens,"w.c.Link(Dependent=w.c.Emotions_Entities(ASP_SENT_NULL=ASPECT, begin=15530, end=15538, entitycategory=PERSON), Governor=w.c.Emotions_Entities(ASP_SENT_NULL=SENTIMENT, begin=15520, end=15529, sentimentcategory=4), begin=15530, end=15538, linktype=sentiment_of)",Humboldt,"Très cher Humboldt , je suis entré dans des détails bien minu- tieux , jeté prie dem'excuser .",ASPECT,4,PERSON
1553,BHL_1025_sample_French_20.0.txt,BHL_1025_sample_French_20.0.txt_15695-15793,15775,15778,Eltine_Janssens,"w.c.Link(Dependent=w.c.Emotions_Entities(ASP_SENT_NULL=NULL, begin=15775, end=15778, entitycategory=PERSON, sentimentcategory=4), Governor=w.c.Emotions_Entities(ASP_SENT_NULL=SENTIMENT, begin=15779, end=15785, sentimentcategory=4), begin=15775, end=15778, linktype=sentiment_of)",ami,Sois assez bon pour me dire un mot de temps en temps et pense quelquefois à ton ami fidèle ( 1 ) .,NULL,4,PERSON
1554,BHL_1025_sample_French_20.0.txt,BHL_1025_sample_French_20.0.txt_18387-18708,18405,18410,Eltine_Janssens,"w.c.Link(Dependent=w.c.Emotions_Entities(ASP_SENT_NULL=NULL, begin=18405, end=18410, entitycategory=PERSON, sentimentcategory=4), Governor=w.c.Emotions_Entities(ASP_SENT_NULL=SENTIMENT, begin=18400, end=18404), begin=18405, end=18410, linktype=sentiment_of)",amigo,"No dudo , mi buen amigo , se haga Vm . inmortal por su viage , por sus mucbos y utiiissimos descubrimientos y bellas é intere- santes observationes , las quales espero con ansia ver publicadas quanto antes en honor y beneficio de la humanidad y de la Patria , de cuyos méritos esVm . digno del mayor elogio y récompensa .",NULL,,PERSON
1555,BHL_1025_sample_French_20.0.txt,BHL_1025_sample_French_20.0.txt_19349-19462,19360,19365,Eltine_Janssens,"w.c.Link(Dependent=w.c.Emotions_Entities(ASP_SENT_NULL=NULL, begin=19360, end=19365, entitycategory=PERSON, sentimentcategory=4), Governor=w.c.Emotions_Entities(ASP_SENT_NULL=SENTIMENT, begin=19352, end=19359, sentimentcategory=4), begin=19360, end=19365, linktype=sentiment_of)",amigo,"Mi cordial amigo y respetable Botânico , le encargo â Vm . averique si el librero M. de Bœur , corresponsal de M.",NULL,4,PERSON
1556,BHL_1025_sample_French_20.0.txt,BHL_1025_sample_French_20.0.txt_20364-20443,20385,20388,Eltine_Janssens,"w.c.Link(Dependent=w.c.Emotions_Entities(ASP_SENT_NULL=NULL, begin=20385, end=20388, entitycategory=PERSON, sentimentcategory=4), Governor=w.c.Emotions_Entities(ASP_SENT_NULL=SENTIMENT, begin=20380, end=20384, sentimentcategory=4), begin=20385, end=20388, linktype=sentiment_of)",ami,"Recevrois , mon cher ami , les assurances de i et les vœux de mon sincer cœur .",NULL,4,PERSON
1557,BHL_1025_sample_French_20.0.txt,BHL_1025_sample_French_20.0.txt_20444-20583,20456,20459,Eltine_Janssens,"w.c.Link(Dependent=w.c.Emotions_Entities(ASP_SENT_NULL=NULL, begin=20456, end=20459, entitycategory=PERSON, sentimentcategory=4), Governor=w.c.Emotions_Entities(ASP_SENT_NULL=SENTIMENT, begin=20450, end=20455, sentimentcategory=4), begin=20456, end=20459, linktype=sentiment_of)",ami,"Votre fîdel ami , LETTRES D'ALEXANDRE DE HUMBOLDT ÉCRITES A AIMÉ BONPLAND OU SE RAPPORTANT ( 1803-1858 ) A AIMÉ BONPLAND faut une réponse .",NULL,4,PERSON
1558,BHL_1025_sample_French_20.0.txt,BHL_1025_sample_French_20.0.txt_20952-21025,20998,21005,Eltine_Janssens,"w.c.Link(Dependent=w.c.Emotions_Entities(ASP_SENT_NULL=NULL, begin=20998, end=21005, entitycategory=PERSON, sentimentcategory=3), Governor=w.c.Emotions_Entities(ASP_SENT_NULL=SENTIMENT, begin=20992, end=20997, entitycategory=PERSON), begin=20998, end=21005, linktype=sentiment_of)",médecin,J'ai un rhu- matisme dans le brasque le grand médecin croit scorbutique .,NULL,,PERSON
1559,BHL_1025_sample_French_20.0.txt,BHL_1025_sample_French_20.0.txt_21311-21654,21411,21419,Eltine_Janssens,"w.c.Link(Dependent=w.c.Emotions_Entities(ASP_SENT_NULL=ASPECT, begin=21411, end=21419, entitycategory=PERSON), Governor=w.c.Emotions_Entities(ASP_SENT_NULL=NULL, begin=21422, end=21433, entitycategory=PERSON, sentimentcategory=3), begin=21411, end=21419, linktype=refers_to)",Luis Née,"Faites-vous une liste des gens qu'il faut louer pér- il ; ' ( 4 ) Cette lettre manque aussi . ( 5 ) Luis Née , naturaliste français , devenu i de Malaspina autour du monde . 222 APPENDICES pétuellement et louez à la fois Née , Zéa ( 1 ) , Mutis ( 2 ) , Cava- nilles ( 3 ) , Sessée ( 4 ) , Pavon etRuiz ( o ) , et Tafalla ( 6 ) et01medo ( 7 ) .",ASPECT,3,PERSON
1560,BHL_1025_sample_French_20.0.txt,BHL_1025_sample_French_20.0.txt_23289-23519,23309,23321,Eltine_Janssens,"w.c.Link(Dependent=w.c.Emotions_Entities(ASP_SENT_NULL=ASPECT, begin=23309, end=23321, entitycategory=PERSON), Governor=w.c.Emotions_Entities(ASP_SENT_NULL=NULL, begin=23365, end=23390, entitycategory=PERSON, sentimentcategory=3), begin=23309, end=23321, linktype=refers_to)",Juan Tafalla,"Hamy , Joseph ( 6 ) Juan Tafalla , élève et continuateur de Ruiz et Pavon , professeur de bo- tanique à Lima . ( 7 ) Vicente Olmedo , botaniste envoyé en 1790 à Loxa pour étudier les LETTRES D ALEXANDRE DE HUMBOL Cayambé ( 1 ) ...",ASPECT,3,PERSON
1561,BHL_1025_sample_French_20.0.txt,BHL_1025_sample_French_20.0.txt_23289-23519,23309,23321,Eltine_Janssens,"w.c.Link(Dependent=w.c.Emotions_Entities(ASP_SENT_NULL=ASPECT, begin=23309, end=23321, entitycategory=PERSON), Governor=w.c.Emotions_Entities(ASP_SENT_NULL=NULL, begin=23324, end=23329, entitycategory=PERSON, sentimentcategory=3), begin=23309, end=23321, linktype=refers_to)",Juan Tafalla,"Hamy , Joseph ( 6 ) Juan Tafalla , élève et continuateur de Ruiz et Pavon , professeur de bo- tanique à Lima . ( 7 ) Vicente Olmedo , botaniste envoyé en 1790 à Loxa pour étudier les LETTRES D ALEXANDRE DE HUMBOL Cayambé ( 1 ) ...",ASPECT,3,PERSON
1562,BHL_1025_sample_French_20.0.txt,BHL_1025_sample_French_20.0.txt_23289-23519,23309,23321,Eltine_Janssens,"w.c.Link(Dependent=w.c.Emotions_Entities(ASP_SENT_NULL=ASPECT, begin=23309, end=23321, entitycategory=PERSON), Governor=w.c.Emotions_Entities(ASP_SENT_NULL=NULL, begin=23333, end=23362, entitycategory=PERSON, sentimentcategory=3), begin=23309, end=23321, linktype=refers_to)",Juan Tafalla,"Hamy , Joseph ( 6 ) Juan Tafalla , élève et continuateur de Ruiz et Pavon , professeur de bo- tanique à Lima . ( 7 ) Vicente Olmedo , botaniste envoyé en 1790 à Loxa pour étudier les LETTRES D ALEXANDRE DE HUMBOL Cayambé ( 1 ) ...",ASPECT,3,PERSON
1563,BHL_1025_sample_French_20.0.txt,BHL_1025_sample_French_20.0.txt_23289-23519,23406,23420,Eltine_Janssens,"w.c.Link(Dependent=w.c.Emotions_Entities(ASP_SENT_NULL=ASPECT, begin=23406, end=23420, entitycategory=PERSON), Governor=w.c.Emotions_Entities(ASP_SENT_NULL=NULL, begin=23423, end=23432, entitycategory=PERSON, sentimentcategory=3), begin=23406, end=23420, linktype=refers_to)",Vicente Olmedo,"Hamy , Joseph ( 6 ) Juan Tafalla , élève et continuateur de Ruiz et Pavon , professeur de bo- tanique à Lima . ( 7 ) Vicente Olmedo , botaniste envoyé en 1790 à Loxa pour étudier les LETTRES D ALEXANDRE DE HUMBOL Cayambé ( 1 ) ...",ASPECT,3,PERSON
1564,BHL_1025_sample_French_20.0.txt,BHL_1025_sample_French_20.0.txt_24538-24612,24554,24562,Eltine_Janssens,"w.c.Link(Dependent=w.c.Emotions_Entities(ASP_SENT_NULL=ASPECT, begin=24554, end=24562, entitycategory=PERSON), Governor=w.c.Emotions_Entities(ASP_SENT_NULL=SENTIMENT, begin=24549, end=24553, sentimentcategory=4), begin=24554, end=24562, linktype=sentiment_of)",Bonpland,"Mais . mon cher Bonpland , vous devez pousser votre générosité plus loin .",ASPECT,4,PERSON
1565,BHL_1025_sample_French_20.0.txt,BHL_1025_sample_French_20.0.txt_24613-24687,24663,24685,Eltine_Janssens,"w.c.Link(Dependent=w.c.Emotions_Entities(ASP_SENT_NULL=ASPECT, begin=24663, end=24685, entitycategory=FAUNA), Governor=w.c.Emotions_Entities(ASP_SENT_NULL=ASPECT, begin=24744, end=24751, entitycategory=FAUNA), begin=24663, end=24685, linktype=refers_to)",insectes coléop- tères,"Il faut , il faut que vous me donniez sept à huit insectes coléop- tères .",ASPECT,,FAUNA
1566,BHL_1025_sample_French_20.0.txt,BHL_1025_sample_French_20.0.txt_24688-24753,24702,24719,Eltine_Janssens,"w.c.Link(Dependent=w.c.Emotions_Entities(ASP_SENT_NULL=ASPECT, begin=24702, end=24719, entitycategory=PERSON), Governor=w.c.Emotions_Entities(ASP_SENT_NULL=NULL, begin=24696, end=24699, entitycategory=PERSON, sentimentcategory=4), begin=24702, end=24719, linktype=sentiment_of)",le comte de Hagen,"J'ai un ami , le comte de Hagen , qui se tue pour cette vermine .",ASPECT,4,PERSON
1567,BHL_1025_sample_French_20.0.txt,BHL_1025_sample_French_20.0.txt_25081-25176,25166,25174,Eltine_Janssens,"w.c.Link(Dependent=w.c.Emotions_Entities(ASP_SENT_NULL=ASPECT, begin=25166, end=25174, entitycategory=PERSON), Governor=w.c.Emotions_Entities(ASP_SENT_NULL=SENTIMENT, begin=25161, end=25165, sentimentcategory=4), begin=25166, end=25174, linktype=sentiment_of)",Bonpland,"Je promets à d'autres sans tenir parole ; je n'agis pas ainsi envers vous , mon cher Bonpland .",ASPECT,4,PERSON
1568,BHL_1025_sample_French_20.0.txt,BHL_1025_sample_French_20.0.txt_595-683,630,638,sarah_a,"w.c.Link(Dependent=w.c.Emotions_Entities(ASP_SENT_NULL=ASPECT, begin=630, end=638, entitycategory=PERSON), Governor=w.c.Emotions_Entities(ASP_SENT_NULL=ASPECT, begin=645, end=648), begin=630, end=638, linktype=refers_to)",Humboldt,PS . — J'ai écrit plusieurs fois à Humboldt et je lui écrirai de nouveau de Corrientes .,ASPECT,,PERSON
1569,BHL_1025_sample_French_20.0.txt,BHL_1025_sample_French_20.0.txt_875-1005,971,984,sarah_a,"w.c.Link(Dependent=w.c.Emotions_Entities(ASP_SENT_NULL=ASPECT, begin=971, end=984, entitycategory=PERSON), Governor=w.c.Emotions_Entities(ASP_SENT_NULL=SENTIMENT, begin=997, end=1003, sentimentcategory=2), begin=971, end=984, linktype=sentiment_of)",Senor Pucheta,"Il y a long- temps je fus appelé dans cette petite mission pour visiter le com- mandant , alors Senor Pucheta , qui était malade .",ASPECT,2,PERSON
1570,BHL_1025_sample_French_20.0.txt,BHL_1025_sample_French_20.0.txt_875-1005,971,984,sarah_a,"w.c.Link(Dependent=w.c.Emotions_Entities(ASP_SENT_NULL=ASPECT, begin=971, end=984, entitycategory=PERSON), Governor=w.c.Emotions_Entities(ASP_SENT_NULL=ASPECT, begin=1075, end=1077), begin=971, end=984, linktype=refers_to)",Senor Pucheta,"Il y a long- temps je fus appelé dans cette petite mission pour visiter le com- mandant , alors Senor Pucheta , qui était malade .",ASPECT,,PERSON
1571,BHL_1025_sample_French_20.0.txt,BHL_1025_sample_French_20.0.txt_1589-1721,1672,1689,sarah_a,"w.c.Link(Dependent=w.c.Emotions_Entities(ASP_SENT_NULL=ASPECT, begin=1672, end=1689, entitycategory=HUM_LANDFORM), Governor=w.c.Emotions_Entities(ASP_SENT_NULL=ASPECT, begin=1697, end=1702), begin=1672, end=1689, linktype=refers_to)",mines de ce métal,"Je fis ensuite toutes les démarches nécessaires pour m'assurer de l'exis- tence de mines de ce métal , mais elles restèrent vaines .",ASPECT,,HUM_LANDFORM
1572,BHL_1025_sample_French_20.0.txt,BHL_1025_sample_French_20.0.txt_1589-1721,1697,1702,sarah_a,"w.c.Link(Dependent=w.c.Emotions_Entities(ASP_SENT_NULL=ASPECT, begin=1697, end=1702), Governor=w.c.Emotions_Entities(ASP_SENT_NULL=SENTIMENT, begin=1713, end=1719, sentimentcategory=2), begin=1697, end=1702, linktype=sentiment_of)",elles,"Je fis ensuite toutes les démarches nécessaires pour m'assurer de l'exis- tence de mines de ce métal , mais elles restèrent vaines .",ASPECT,2,
1625,GB-156_sample_French_20.txt,GB-156_sample_French_20.txt_347-696,689,694,Eltine_Janssens,"w.c.Link(Dependent=w.c.Emotions_Entities(ASP_SENT_NULL=ASPECT, begin=689, end=694, entitycategory=MYTH), Governor=w.c.Emotions_Entities(ASP_SENT_NULL=SENTIMENT, begin=685, end=688, sentimentcategory=4), begin=689, end=694, linktype=sentiment_of)",géant,"Il doutait non pas de lui , mais de son étoile ; et Dumas fils revoyait toujours la grande ombre de son père se profilant sous un coup de lune sur ce mur humide et mélancolique de l'Institut , et lui , craintif , devinant les angoisses paternelles et s'efforçant de suivre , avec ses petites jambes de huit ans , les grandes enjambées du bon géant !",ASPECT,4,MYTH
1626,GB-156_sample_French_20.txt,GB-156_sample_French_20.txt_990-1282,1200,1210,Eltine_Janssens,"w.c.Link(Dependent=w.c.Emotions_Entities(ASP_SENT_NULL=ASPECT, begin=1200, end=1210, entitycategory=PERSON), Governor=w.c.Emotions_Entities(ASP_SENT_NULL=SENTIMENT, begin=1194, end=1199, sentimentcategory=4), begin=1200, end=1210, linktype=sentiment_of)",Parisienne,"Brissot , Buzot , Pétion , Robespierre , Danton lui-même , prenaient plaisir à venir entre deux séances causer chez cette aimable femme ; et j'imagine que ce qui les attirait , c'était le charme de cette jolie Parisienne plus que les vertus de l'austère Roland qui devait être bien ennuyeux !",ASPECT,4,PERSON
1627,GB-156_sample_French_20.txt,GB-156_sample_French_20.txt_990-1282,1244,1250,Eltine_Janssens,"w.c.Link(Dependent=w.c.Emotions_Entities(ASP_SENT_NULL=ASPECT, begin=1244, end=1250, entitycategory=PERSON), Governor=w.c.Emotions_Entities(ASP_SENT_NULL=SENTIMENT, begin=1234, end=1243, sentimentcategory=2), begin=1244, end=1250, linktype=sentiment_of)",Roland,"Brissot , Buzot , Pétion , Robespierre , Danton lui-même , prenaient plaisir à venir entre deux séances causer chez cette aimable femme ; et j'imagine que ce qui les attirait , c'était le charme de cette jolie Parisienne plus que les vertus de l'austère Roland qui devait être bien ennuyeux !",ASPECT,2,PERSON
1628,GB-156_sample_French_20.txt,GB-156_sample_French_20.txt_990-1282,1244,1250,Eltine_Janssens,"w.c.Link(Dependent=w.c.Emotions_Entities(ASP_SENT_NULL=ASPECT, begin=1244, end=1250, entitycategory=PERSON), Governor=w.c.Emotions_Entities(ASP_SENT_NULL=SENTIMENT, begin=1267, end=1280, sentimentcategory=1), begin=1244, end=1250, linktype=sentiment_of)",Roland,"Brissot , Buzot , Pétion , Robespierre , Danton lui-même , prenaient plaisir à venir entre deux séances causer chez cette aimable femme ; et j'imagine que ce qui les attirait , c'était le charme de cette jolie Parisienne plus que les vertus de l'austère Roland qui devait être bien ennuyeux !",ASPECT,1,PERSON
1629,GB-156_sample_French_20.txt,GB-156_sample_French_20.txt_1283-1569,1442,1447,Eltine_Janssens,"w.c.Link(Dependent=w.c.Emotions_Entities(ASP_SENT_NULL=ASPECT, begin=1442, end=1447, entitycategory=PERSON), Governor=w.c.Emotions_Entities(ASP_SENT_NULL=SENTIMENT, begin=1435, end=1441, sentimentcategory=3), begin=1442, end=1447, linktype=sentiment_of)",Manon,"C'est là que , le 21 mars 1792 , Dumouriez vint sonner à la porte de Roland pour lui annoncer : « Vous êtes Ministre » , et quelques jours plus tard la petite Manon du quai des Lunettes s'installait triomphalement à l'hôtel de Calonne : c'était hélas pour elle le chemin de l'échafaud !",ASPECT,3,PERSON
1630,GB-156_sample_French_20.txt,GB-156_sample_French_20.txt_1283-1569,1442,1447,Eltine_Janssens,"w.c.Link(Dependent=w.c.Emotions_Entities(ASP_SENT_NULL=ASPECT, begin=1442, end=1447, entitycategory=PERSON), Governor=w.c.Emotions_Entities(ASP_SENT_NULL=SENTIMENT, begin=1482, end=1496, sentimentcategory=4), begin=1442, end=1447, linktype=sentiment_of)",Manon,"C'est là que , le 21 mars 1792 , Dumouriez vint sonner à la porte de Roland pour lui annoncer : « Vous êtes Ministre » , et quelques jours plus tard la petite Manon du quai des Lunettes s'installait triomphalement à l'hôtel de Calonne : c'était hélas pour elle le chemin de l'échafaud !",ASPECT,4,PERSON
1631,GB-156_sample_French_20.txt,GB-156_sample_French_20.txt_1716-1920,1756,1763,Eltine_Janssens,"w.c.Link(Dependent=w.c.Emotions_Entities(ASP_SENT_NULL=SENTIMENT, begin=1756, end=1763, sentimentcategory=2), Governor=w.c.Emotions_Entities(ASP_SENT_NULL=ASPECT, begin=1764, end=1767, entitycategory=HUM_LANDFORM), begin=1756, end=1763, linktype=sentiment_of)",vieille,"Malgré ses récentes démolitions , cette vieille rue renferme encore quelques anciennes demeures ; mais elle a perdu la si bizarre maison dite _le Château Rouge_ , ou plus prosaïquement « la Guillotine » .",SENTIMENT,,
1632,GB-156_sample_French_20.txt,GB-156_sample_French_20.txt_1716-1920,1846,1852,Eltine_Janssens,"w.c.Link(Dependent=w.c.Emotions_Entities(ASP_SENT_NULL=ASPECT, begin=1846, end=1852, entitycategory=HUM_LANDFORM), Governor=w.c.Emotions_Entities(ASP_SENT_NULL=SENTIMENT, begin=1835, end=1845, sentimentcategory=2), begin=1846, end=1852, linktype=sentiment_of)",maison,"Malgré ses récentes démolitions , cette vieille rue renferme encore quelques anciennes demeures ; mais elle a perdu la si bizarre maison dite _le Château Rouge_ , ou plus prosaïquement « la Guillotine » .",ASPECT,2,HUM_LANDFORM
